{
  "combinations": [
    {
      "client_meaning": "В карточке есть оба семейных инфраструктурных признака.",
      "forbidden_leap": "Не обещать места, закрепление или точную пешую доступность.",
      "id": "school_plus_kindergarten",
      "required_cards": [
        "school",
        "kindergarten"
      ],
      "required_evidence": [
        "school evidence",
        "kindergarten evidence"
      ],
      "safe_phrasing": "Для семейного сценария в карточке указаны и школа, и детский сад; расстояния и места лучше уточнить отдельно."
    }
  ],
  "constraints": {
    "facts_are_canonical": true,
    "no_new_facts": true,
    "registry_version": "v1"
  },
  "diagnostics": {
    "omitted_field_ids": [
      {
        "field_id": "ads_count",
        "reason": "not_relevant"
      },
      {
        "field_id": "apartment_price",
        "reason": "not_relevant"
      },
      {
        "field_id": "sales_count",
        "reason": "not_relevant"
      },
      {
        "field_id": "house_link",
        "reason": "unsafe_value"
      }
    ],
    "unknown_field_ids": [
      "seller_phone"
    ]
  },
  "fields": [
    {
      "allowed_benefit": "Можно отметить семейную логистику, если школа подтверждена в карточке.",
      "field_id": "school",
      "forbidden_claims": [
        "Не обещать качество школы, закрепление, места или точное расстояние без evidence."
      ],
      "label": "школа рядом",
      "literal_meaning": "В карточке есть подтверждение школы или школьной инфраструктуры.",
      "rendering_rules": [
        "Писать «в карточке указана школа», если нет расстояния или названия."
      ],
      "required_evidence": [
        "school flag or canonical infrastructure school label is present"
      ],
      "strength": "strong",
      "value": true
    },
    {
      "allowed_benefit": "Можно отметить удобство для семьи с маленьким ребёнком, если детский сад подтверждён.",
      "field_id": "kindergarten",
      "forbidden_claims": [
        "Не обещать места, качество сада или точную пешую доступность без evidence."
      ],
      "label": "детский сад рядом",
      "literal_meaning": "В карточке есть подтверждение детского сада.",
      "rendering_rules": [
        "Не усиливать формулировку сверх буквального признака."
      ],
      "required_evidence": [
        "kindergarten flag or canonical infrastructure kindergarten label is present"
      ],
      "strength": "strong",
      "value": true
    },
    {
      "allowed_benefit": "Можно отметить дворовую инфраструктуру для ребёнка, если площадка подтверждена.",
      "field_id": "children_ground",
      "forbidden_claims": [
        "Не описывать состояние, безопасность или возраст площадки без evidence."
      ],
      "label": "детская площадка",
      "literal_meaning": "В карточке подтверждена детская площадка.",
      "rendering_rules": [
        "Писать буквально: «есть детская площадка»."
      ],
      "required_evidence": [
        "children_ground flag or canonical label is present"
      ],
      "strength": "supporting",
      "value": true
    },
    {
      "allowed_benefit": "Помогает понять, есть ли семейные форматы, но не подтверждает наличие конкретной квартиры.",
      "field_id": "room_formats",
      "forbidden_claims": [
        "Не утверждать наличие конкретного лота без inventory или lot evidence."
      ],
      "label": "форматы квартир",
      "literal_meaning": "Нормализованные комнатности: студии, 1, 2, 3, 4.",
      "rendering_rules": [
        "Не искать комнатность подстрокой; использовать только canonical formats."
      ],
      "required_evidence": [
        "fresh MCP response",
        "canonical room_formats or rooms is present"
      ],
      "strength": "supporting",
      "value": [
        "студия",
        "1",
        "2"
      ]
    }
  ],
  "fresh_mcp": true,
  "object_name": "Синтетический ЖК",
  "scenario": "family",
  "schema_version": 1
}
